{
  "spec_version": "1.1",
  "event_type": "maintenance.completion",
  "event_id": "c4d5e6f7-a8b9-0c1d-2e3f-4a5b6c7d8e9f",
  "correlation_id": "3b2f9d8c-1c33-4a8a-9b77-54d11b2efc12",
  "source_event_id": "e2f3a4b5-c6d7-8e9f-0a1b-2c3d4e5f6a7b",
  "timestamp": "2026-03-07T09:15:00Z",
  "source": "acme.cmms",
  "content_hash": "7c4e9a2f1d6b3e8a",
  "asset": {
    "asset_id": "MOTOR-001",
    "asset_name": "Motor Bomba P-101",
    "plant": "Pesqueria",
    "area": "Turbinas"
  },
  "data": {
    "status": "completed",
    "work_order_id": "WO-2026-0042",
    "actual_duration_seconds": 7200,
    "technician_id": "TECH-003",
    "checklist_completion_pct": 100,
    "completion_notes": "Bearing replaced. Vibration test post-repair: 0.8 mm/s RMS. Within acceptable limits.",
    "spare_parts_count": 1,
    "failure_confirmed": true,
    "failure_mode": "bearing_inner_race"
  }
}
