{
  "spec_version": "2.0",
  "event_type": "maintenance.spare_part_usage",
  "event_id": "d1a2b3c4-d5e6-7f8a-9b0c-1d2e3f4a5b6c",
  "correlation_id": "3b2f9d8c-1c33-4a8a-9b77-54d11b2efc12",
  "source_event_id": "c4d5e6f7-a8b9-0c1d-2e3f-4a5b6c7d8e9f",
  "timestamp": "2026-03-07T09:16:00Z",
  "source": "acme.cmms",
  "content_hash": "6f7a8b9c0d1e2f3a",
  "asset": {
    "asset_id": "MOTOR-001",
    "asset_name": "Motor Bomba P-101",
    "plant": "Planta Norte",
    "area": "Turbinas"
  },
  "data": {
    "work_order_id": "WO-2026-0042",
    "spare_part_id": "SP-SKF-6205",
    "quantity_used": 1,
    "part_number": "SKF 6205-2RS",
    "part_name": "Rodamiento rigido de bolas 6205-2RS",
    "unit_cost": 28.50,
    "currency": "USD",
    "total_cost": 28.50
  }
}
